{
  "case_id": "GC-009-ru-recommendation-vs-decision",
  "source_revision_refs": [
    "golden-ru-decisions-r1"
  ],
  "scope_expression": {
    "kind": "SELECTED_SOURCES",
    "source_ids": [
      "golden-ru-decisions"
    ]
  },
  "question": "Какая топология продакшена решена, а какой путь захвата лишь рекомендован?",
  "expected_product": "RESEARCH",
  "required_atoms": [
    "D-RU-001 is a decision",
    "R-RU-001 is a recommendation"
  ],
  "forbidden_collapses": [
    "recommendation promoted to decision",
    "future transport presented as active"
  ],
  "required_evidence_handle_refs": [
    {
      "id": "handle-gc009-decision",
      "revision": 1
    },
    {
      "id": "handle-gc009-recommendation",
      "revision": 1
    }
  ],
  "acceptable_unknowns": [
    "whether Browser Rendering is enabled in a deployed account"
  ],
  "coverage_requirement": "complete_scope",
  "adjudication_notes": "The answer must preserve Russian modality (решение vs рекомендация) and cite separate exact spans; model paraphrase is never an oracle."
}
